{
  "module": "Módulo 10",
  "title": "Análisis Geopolítico para la Inversión",
  "totalQuestions": 37,
  "questions": [
    {
      "id": "m10-1",
      "block": "BLOQUE I: Análisis Macroeconómico y Riesgo País",
      "question": "Un inversor observa que el PIB de un país creció un 3% el último trimestre debido exclusivamente al adelanto de importaciones antes de aranceles. ¿Qué debería concluir?",
      "options": [
        "La economía está sólida y es momento ideal para invertir masivamente",
        "Es una distorsión temporal que no refleja la tendencia estructural real",
        "El consumo privado está impulsando un crecimiento sostenible a largo plazo",
        "La política comercial del país está mejorando su competitividad internacional permanentemente"
      ],
      "correctAnswer": 1,
      "explanation": "El adelanto distorsiona temporalmente el PIB cuando importadores anticipan compras masivas antes de aranceles. No refleja demanda real sino una anomalía coyuntural. El trimestre siguiente mostrará probablemente un rebote artificial. Es fundamental contextualizar datos macro y distinguir entre cambios estructurales y ruido temporal generado por eventos políticos puntuales."
    },
    {
      "id": "m10-2",
      "block": "BLOQUE I: Análisis Macroeconómico y Riesgo País",
      "question": "Una empresa cotiza en Europa pero genera 60% de ventas en Estados Unidos y 40% en mercados emergentes de alto riesgo. ¿Cómo calcular su coste de capital correctamente?",
      "options": [
        "Usar solo el CRP del país donde tiene la sede fiscal registrada",
        "Aplicar el CRP más elevado de todos los mercados donde opera por precaución",
        "Usar una prima ponderada por exposición geográfica real de operaciones",
        "Ignorar completamente el riesgo geográfico en el cálculo del WACC"
      ],
      "correctAnswer": 2,
      "explanation": "El coste de capital debe reflejar dónde la empresa genera realmente sus ingresos, no solo dónde cotiza. Si el 40% de ventas provienen de mercados de alto riesgo, esa exposición requiere una prima. Se calcula un CRP ponderado: 60% × CRP(USA) + 40% × CRP(emergentes), reflejando el riesgo real del negocio."
    },
    {
      "id": "m10-3",
      "block": "BLOQUE I: Análisis Macroeconómico y Riesgo País",
      "question": "Un país muestra simultáneamente: spread bid-ask amplio, skew bajista en opciones y bid-to-cover bajo en subastas. ¿Qué indica esto?",
      "options": [
        "Expectativas de crecimiento acelerado y optimismo del mercado",
        "Mejora de liquidez y confianza inversora creciente",
        "Deterioro de liquidez, miedo y desconfianza en deuda soberana",
        "Estabilidad y condiciones normales de mercado"
      ],
      "correctAnswer": 2,
      "explanation": "Spread bid-ask amplio indica menor liquidez. Skew bajista significa que inversores pagan más por protección (puts) que por apuestas alcistas, reflejando miedo. Bid-to-cover bajo muestra escasa demanda en subastas de deuda, señal de desconfianza. Los tres indicadores juntos confirman deterioro severo de confianza del mercado."
    },
    {
      "id": "m10-4",
      "block": "BLOQUE I: Análisis Macroeconómico y Riesgo País",
      "question": "¿Por qué Singapur sin recursos naturales puede ser más desarrollado que países ricos en petróleo y minerales?",
      "options": [
        "Porque Singapur recibe ayuda internacional masiva constantemente",
        "Porque los países con recursos siempre tienen corrupción inevitable",
        "Porque el tamaño geográfico pequeño es ventaja absoluta automática",
        "Porque lo decisivo es la capacidad institucional y eficiencia, no la posesión de recursos"
      ],
      "correctAnswer": 3,
      "explanation": "La historia demuestra que abundancia de recursos no garantiza desarrollo. Lo crítico son instituciones sólidas, marcos legales predecibles, capital humano y eficiencia en explotación y distribución. Singapur prosperó sin recursos mediante instituciones eficientes, apertura comercial y rule of law. La riqueza natural sin capacidad institucional raramente se traduce en bienestar."
    },
    {
      "id": "m10-5",
      "block": "BLOQUE I: Análisis Macroeconómico y Riesgo País",
      "question": "Una empresa similar cotiza con PER 25 en EE.UU. y PER 12 en un mercado emergente. ¿Qué explica esta diferencia?",
      "options": [
        "El Country Risk Premium diferente afecta la tasa de descuento y justifica múltiplos distintos",
        "La empresa americana siempre es mejor gestionada objetivamente",
        "Los mercados emergentes están siempre infravalorados por definición estructural",
        "Es pura especulación sin fundamento económico real subyacente"
      ],
      "correctAnswer": 0,
      "explanation": "El PER está inversamente relacionado con el coste de capital. Riesgo geopolítico elevado aumenta el CRP, elevando la tasa de descuento y reduciendo el valor presente de flujos futuros. EE.UU. con CRP=0 justifica PER más alto; emergentes con CRP elevado justifican PER menores. No es que estén 'baratos', sino que reflejan el riesgo correctamente."
    },
    {
      "id": "m10-6",
      "block": "BLOQUE II: Geopolítica, Mercados y Política Monetaria",
      "question": "Tras una invasión militar, el petróleo sube bruscamente, luego se estabiliza y finalmente se ajusta a un nuevo nivel permanente. ¿Qué explica este patrón?",
      "options": [
        "Shock inicial por incertidumbre, estabilización al procesar info y ajuste estructural si el cambio es duradero",
        "Los mercados son completamente ineficientes y reaccionan aleatoriamente siempre",
        "La OPEP manipula artificialmente los precios globales del petróleo en tres fases",
        "Es coincidencia sin patrón predecible ni explicación económica válida"
      ],
      "correctAnswer": 0,
      "explanation": "Las crisis geopolíticas siguen un patrón sistemático. Primero, el shock inicial genera reacción violenta por máxima incertidumbre. Luego viene estabilización cuando los agentes procesan información y encuentran un equilibrio temporal. Finalmente, si el cambio es permanente (sanciones duraderas, bloqueos), el precio se ajusta a un nuevo nivel estructural diferente. Este patrón se observó con petróleo, rublo y trigo durante la invasión de Ucrania."
    },
    {
      "id": "m10-7",
      "block": "BLOQUE II: Geopolítica, Mercados y Política Monetaria",
      "question": "El BCE ve inflación al 1% y recesión. Según regla de Taylor, ¿qué haría?",
      "options": [
        "Subir tipos para controlar la economía débil",
        "Implementar directamente estímulo fiscal expansivo",
        "Bajar tipos porque inflación está bajo objetivo (~2%)",
        "Mantener tipos invariables esperando recuperación"
      ],
      "correctAnswer": 2,
      "explanation": "La regla de Taylor indica que bancos centrales ajustan tipos según desviación de inflación del objetivo. Si el BCE tiene mandato de ~2% y observa 1%, existe desviación negativa. La respuesta es bajar tipos para estimular economía y presionar inflación al alza hacia el objetivo, cumpliendo su mandato de estabilidad de precios."
    },
    {
      "id": "m10-8",
      "block": "BLOQUE II: Geopolítica, Mercados y Política Monetaria",
      "question": "¿Por qué la neutralidad de Suiza desde 1815 ha sido clave para su éxito económico más allá del ahorro militar?",
      "options": [
        "Otros países están obligados a darle ayudas económicas permanentes regularmente",
        "No paga impuestos ni contribuciones a organizaciones internacionales",
        "Le permite ser sede neutral, centro financiero, divisa refugio y mantener CRP cero",
        "Tiene acceso exclusivo a recursos naturales estratégicos vedados a otros"
      ],
      "correctAnswer": 2,
      "explanation": "La neutralidad suiza creó un ecosistema único: espacio seguro para organizaciones internacionales (Cruz Roja, OMS, OMC), centro financiero confiable donde el capital está protegido de guerras y confiscaciones, franco como divisa refugio global, y prima de riesgo cero. Este círculo virtuoso donde estabilidad geopolítica genera prosperidad económica es la clave de su éxito."
    },
    {
      "id": "m10-9",
      "block": "BLOQUE II: Geopolítica, Mercados y Política Monetaria",
      "question": "Un país exportador exige que su petróleo solo se pague en su moneda nacional. ¿Efecto sobre tipo de cambio?",
      "options": [
        "Depreciación por aumento de oferta monetaria doméstica",
        "Apreciación por demanda forzosa de la divisa",
        "Sin efecto relevante en mercados cambiarios",
        "Volatilidad aleatoria sin dirección predecible"
      ],
      "correctAnswer": 1,
      "explanation": "Exigir pago en moneda nacional crea demanda artificial. Compradores internacionales deben adquirir esa divisa obligatoriamente para comprar el commodity, generando presión compradora y apreciación. Exactamente lo que pasó con el rublo: tras la invasión de Ucrania, Putin exigió pagos en rublos por energía, y la moneda se recuperó porque Europa necesitaba comprar rublos para pagar el gas."
    },
    {
      "id": "m10-10",
      "block": "BLOQUE II: Geopolítica, Mercados y Política Monetaria",
      "question": "¿Por qué el análisis geopolítico rechaza el determinismo 'centro-periferia' que fija jerarquías permanentes entre países?",
      "options": [
        "Porque todos los países tienen exactamente las mismas capacidades naturales",
        "Porque la geografía física nunca ha importado en historia económica",
        "Porque ya no existe el concepto de tercer mundo actualmente",
        "Porque las posiciones son dinámicas y cambian con ideas, tecnología y políticas"
      ],
      "correctAnswer": 3,